{"id":"concept://demo/analogy/00000000000000000000000000","type":"Analogy","namespace":"demo","schema_version":1,"payload":{"source_roles":["river"],"target_roles":["network"],"correspondences":[{"source_role":"river","target_role":"network","source_uri":"concept://demo/concept/00000000000000000000000000","target_uri":"concept://demo/concept/11111111111111111111111111"}],"preserved_relations":["flow"],"known_breaks":["banks differ"],"metric_snapshot":{"semantic":"0.20"},"heuristic_uri":"concept://demo/inspiration-heuristic/00000000000000000000000000"},"representations":[],"provenance_refs":["bbbbbbbbbbbbbbbbbbbbbbbbbbbbbbbbbbbbbbbbbbbbbbbbbbbbbbbbbbbbbbbb"],"recorded_at":"2026-09-04T20:01:00Z"}

