{"id":"concept://demo/hypothesis/00000000000000000000000000","type":"Hypothesis","namespace":"demo","schema_version":1,"payload":{"proposition":"A bounded rule reduces oscillation.","scope":"toy systems","assumptions":["fixed sampling"],"lineage":["concept://demo/concept/00000000000000000000000000"],"expected_observations":["amplitude decreases"],"falsifiers":["amplitude increases"],"lifecycle":"candidate","score_snapshot":{"relevance":"0.70","novelty":"0.80","coherence":"0.60","diversity_contribution":"0.50","cost":"0.10","provenance_completeness":"0.90"}},"representations":[],"provenance_refs":["3333333333333333333333333333333333333333333333333333333333333333"],"recorded_at":"2026-09-04T20:05:00Z"}

